{
  "dmpms_version": "1.0",
  "source_file": "sample2.heic",

  "title": "Amy at the Garden",
  "description": "Captured on a warm afternoon in early spring, from an older phone backup.",

  "tags": ["garden", "portrait", "spring"],
  "people": [
    { "name": "Amy" }
  ],

  "date_taken": "2018",

  "virtual_crops": [
    {
      "id": "crop-8x10-01",
      "label": "Portrait 8x10",
      "aspect_ratio": "8:10",
      "rect": { "x": 0.15, "y": 0.05, "width": 0.70, "height": 0.90 }
    },
    {
      "id": "crop-1x1-01",
      "label": "Square Crop",
      "aspect_ratio": "1:1",
      "rect": { "x": 0.25, "y": 0.15, "width": 0.50, "height": 0.50 }
    }
  ],

  "history": [
    {
      "action": "renamed",
      "old_name": "IMG_2048.HEIC",
      "new_name": "Amy_Garden.heic",
      "timestamp": "2024-04-13T09:01:45-06:00"
    },
    {
      "action": "added_crop",
      "crop_id": "crop-8x10-01",
      "timestamp": "2024-04-13T09:15:00-06:00"
    },
    {
      "action": "added_crop",
      "crop_id": "crop-1x1-01",
      "timestamp": "2024-04-13T09:18:10-06:00"
    }
  ]
}
